{"ir_version":"0.1","core_version":"0.1","module":"demo.main","imports":[],"locked_modules":["demo.main"],"effect_policy":[],"items":[{"public":true,"item":"const","name":"demo__helper__SCALE","ty":{"type":"named","name":"u32"},"value":{"expression":"integer","value":20,"suffix":"u32"}},{"public":true,"item":"function","name":"demo__helper__twice","parameters":[{"name":"value","ty":{"type":"named","name":"u32"}}],"return_type":{"type":"named","name":"u32"},"body":{"statements":[],"tail":{"expression":"binary","left":{"expression":"binary","left":{"expression":"call","callee":{"expression":"path","segments":["demo__helper__bump"]},"arguments":[{"expression":"path","segments":["value"]}]},"operator":"add","right":{"expression":"path","segments":["value"]}},"operator":"subtract","right":{"expression":"integer","value":2,"suffix":"u32"}}}},{"public":false,"item":"function","name":"demo__helper__bump","parameters":[{"name":"value","ty":{"type":"named","name":"u32"}}],"return_type":{"type":"named","name":"u32"},"body":{"statements":[],"tail":{"expression":"binary","left":{"expression":"path","segments":["value"]},"operator":"add","right":{"expression":"integer","value":2,"suffix":"u32"}}}},{"public":true,"item":"const","name":"demo__helper_two__OFFSET","ty":{"type":"named","name":"u32"},"value":{"expression":"integer","value":1,"suffix":"u32"}},{"public":true,"item":"function","name":"demo__helper_two__shift","parameters":[{"name":"value","ty":{"type":"named","name":"u32"}}],"return_type":{"type":"named","name":"u32"},"body":{"statements":[],"tail":{"expression":"binary","left":{"expression":"path","segments":["value"]},"operator":"add","right":{"expression":"path","segments":["demo__helper_two__OFFSET"]}}}},{"public":false,"item":"function","name":"bump","parameters":[{"name":"value","ty":{"type":"named","name":"u32"}}],"return_type":{"type":"named","name":"u32"},"body":{"statements":[],"tail":{"expression":"path","segments":["value"]}}},{"public":false,"item":"const","name":"START","ty":{"type":"named","name":"u32"},"value":{"expression":"binary","left":{"expression":"path","segments":["demo__helper__SCALE"]},"operator":"add","right":{"expression":"path","segments":["demo__helper_two__OFFSET"]}}},{"public":true,"item":"function","name":"argorix_main","parameters":[],"return_type":{"type":"named","name":"bool"},"body":{"statements":[{"statement":"let","mutable":false,"name":"total","annotation":{"type":"named","name":"u32"},"value":{"expression":"binary","left":{"expression":"call","callee":{"expression":"path","segments":["demo__helper__twice"]},"arguments":[{"expression":"path","segments":["demo__helper__SCALE"]}]},"operator":"add","right":{"expression":"call","callee":{"expression":"path","segments":["bump"]},"arguments":[{"expression":"integer","value":2,"suffix":"u32"}]}}}],"tail":{"expression":"binary","left":{"expression":"path","segments":["total"]},"operator":"add","right":{"expression":"call","callee":{"expression":"path","segments":["demo__helper_two__shift"]},"arguments":[{"expression":"path","segments":["START"]}]}}}}]}